_pid,partName,projectURL,_identifiers-1,note-2:note_type,note-2:note_value,_project.string_key,relatedItem_project,title-1:title_sort_portion,_digital_object_type.string_key,title-1:title_non_sort_portion,_parent_digital_objects-1.identifier,omeka_identifier-1:omeka_identifier_value,date_created_textual-1:date_created_textual_value,note-3:note_type,form-2:form_term.uri,form-2:form_term.value,location-1:location_term.uri,location-1:location_term.code,location-1:location_term.value,date_created-1:date_created_type,location-1:location_term.authority,date_created-1:date_created_end_value,date_created-1:date_created_start_value,type_of_resource-1:type_of_resource_value,object_in_context_url-1:object_in_context_url_value,language-1:language_term.uri,language-1:language_term.value,language-1:language_term.authority,digital_origin-1:digital_origin_value,name-1:name_term.uri,name-1:name_term.value,name-1:name_term.authority,name-1:name_term.name_type,name-1:name_role-1.name_role_term.uri,name-1:name_role-1.name_role_term.value,name-1:name_role-1.name_role_term.authority,abstract-1:abstract_value,subject_geographic-1:subject_geographic_term.uri,subject_geographic-1:subject_geographic_term.authority,place_of_origin-1:place_of_origin_value,date_created_textual-2:date_created_textual_value,publisher-1:publisher_value,collection-1:collection_term.uri,collection-1:collection_term.value,place_of_origin-2:place_of_origin_value,subject_name-1:subject_name_term.uri,subject_title-1:subject_title_term.uri,subject_topic-1:subject_topic_term.uri,subject_name-1:subject_name_term.value,subject_topic-1:subject_topic_term.value,subject_title-1:subject_title_term.value,subject_name-1:subject_name_term.name_type,subject_name-1:subject_name_term.authority,subject_topic-1:subject_topic_term.authority,subject_title-1:subject_title_term.authority,subject_hierarchical_geographic-1:subject_hierarchical_geographic_city_text_value,subject_hierarchical_geographic-1:subject_hierarchical_geographic_state_text_value,subject_hierarchical_geographic-1:subject_hierarchical_geographic_county_text_value,subject_hierarchical_geographic-1:subject_hierarchical_geographic_borough_text_value,subject_hierarchical_geographic-1:subject_hierarchical_geographic_province_text_value,subject_hierarchical_geographic-1:subject_hierarchical_geographic_street-1.subject_hierarchical_geographic_street_value,note-1:note_type,note-1:note_value,note-6:note_type,note-6:note_value,note-5:note_type,note-5:note_value,clio_identifier-1:clio_identifier_value,location-1:location_shelf_location-1.location_shelf_location_free_text,location-1:location_shelf_location-1.location_shelf_location_box_number,location-1:location_shelf_location-1.location_shelf_location_folder_number,note-7:note_type,note-3:note_value,note-7:note_value
 , , , ,filename,dream-machine.jpg, ,"""Naked Lunch"": the First Fifty Years",Dream Machine, , , ,9569,1960s,original_format, ,objects, , ,"Rare Book & Manuscript Library, Columbia University",approximate,local, , ,Still Image,https://exhibitions.library.columbia.edu/exhibits/show/nakedlunch/dreammachine/burroughs-the-dream-machine,,,,, ,"Burroughs, William S., 1914-1997 |Gysin, Brion|Sommerville, Ian", , , , , ,"The Dream Machine, a device designed by Burroughs and Brion Gysin and constructed by Ian Sommerville, was designed to help stimulate brain activity and bring about a hallucinatory state. ",,,,,, , William Seward Burroughs Papers,,,,,,,,,,,,,,,,,, ,Date based on the earliest and latest dates of the  William Seward Burroughs Papers collection.,,,,,,,,,,,
 , , , ,filename,festin_nu_cover.jpg, ,"""Naked Lunch"": the First Fifty Years","Festin Nu, front cover", , , ,5049,1964,original_format, ,books, , ,"Rare Book and Manuscript Library, Columbia University",exact,local, , ,Document,https://exhibitions.library.columbia.edu/exhibits/show/nakedlunch/nlbook/nlbooks1, ,French,iso639-2,reformatted digital, ,"Burroughs, William S., 1914-1997|Kahane, Eric H.", , , , , ,"Naked Lunch, translated into French by Eric Kahane",,,Paris,1964,Gallimard,,,,,,,,,,,,,,,,,,,, ,"Rare Book copy: No. 1197.|Rare Book copy: Accompanied by typescript letter from the publisher indicating that the work should not be publicly displayed and above all, should not fall into the hands of minors, due to its shocking content; shelved in separate portfolio.",,,holdings, ,CLIO id: 7793016,PS3552.U75 N314 1964g, , ,original,,Naked Lunch
 , , , ,filename,festin_nu_warning.jpg, ,"""Naked Lunch"": the First Fifty Years","Festin Nu, accompanying letter", , , ,5048,Février 1964,original_format, ,correspondence, , ,"Rare Book and Manuscript Library, Columbia University",exact,local, , ,Document,https://exhibitions.library.columbia.edu/exhibits/show/nakedlunch/nlbook/nlbooks1, ,French,iso639-2,reformatted digital, ,Gallimard (Firm), , , , , ,Letter from the French publishers Les Editions Gallimard to booksellers concerning Le Festin Nu,,,Paris,Février 1964,Gallimard,,,Paris,,,,,,,,,,,,,,,,, ,"Accompaniment to Rare Book copy: No. 1197.|Typescript letter from the publisher indicating that the work should not be publicly displayed and above all, should not fall into the hands of minors, due to its shocking content; shelved in separate portfolio from accompanying book",,,holdings, ,CLIO id: 7793016,PS3552.U75 N314 1964g, , ,,,
 , , , ,filename,100029003c.jpg, ,"""Naked Lunch"": the First Fifty Years",Naked Lunch 50th Anniversary Edition, , , ,2578,"November 1, 2009",original_format,,,,,,,,,,Still Image,,,,,, ,"William S. Burroughs, 1914-1997", , , , , ,Cover and slipcase, , ,,,Grove Press,,,,,,,,,,,,,,,,,,,,,,,,,,,,,,,,
 , , , ,filename,100029002.jpg, ,"""Naked Lunch"": the First Fifty Years",Letter from William S. Burroughs to Peter Matson., , , ,2577,25 August 1976,original_format,,,,,,,,,,Still Image,,,,,, ,"William S. Burroughs, 1914-1997", , , , , ,"Typed letter signed, William S. Burroughs to Peter Matson.   Burroughs states preference that title of new edition of ""Junkie"" be ""Junk"" or ""Junky.""",,,,,,,,,,,,,,,,,,,,,,,,,,,,,,,,,,,original,Original Format: Typed letter,Harold Matson Records.
 , , , ,filename,100029001.jpg, ,"""Naked Lunch"": the First Fifty Years","Junky: the Definitive Text of ""Junk"", front cover", , , ,2576,circa 2003,original_format, ,books, , ,"Rare Book and Manuscript Library, Columbia University",approximate,local, , ,Still Image,https://exhibitions.library.columbia.edu/exhibits/show/nakedlunch/junky/junkie, ,English,iso639-2,reformatted digital, ,"Burroughs, William S., 1914-1997", , , , , ,"Cover of <em>Junky: The Definitive Text of ""Junk"".&nbsp; </em>Advanced uncorrected proof.", , ,New York,2003,Penguin Books,,,,,,,,,,,,,,,,,,,,,,,,,,,,,,,,
 , , , ,filename,meeting_international_conference.mp3, ,"""Naked Lunch"": the First Fifty Years","William Burroughs Reads from ""Naked Lunch:"" ""Meeting of International Conference of Technological Psychiatry""", , , ,2575,probably 1960 - 1972,original_format, ,sound recordings, , ,"Rare Book and Manuscript Library, Columbia University",inferred,local, , ,Sound,https://exhibitions.library.columbia.edu/exhibits/show/nakedlunch/nlreading/nlreading, ,English,iso639-2,reformatted digital, ,"Burroughs, William S., 1914-1997", , , , , ,"William Burroughs reading an excerpt from <em>Naked Lunch</em>: ""Meeting of International Conference of Technological Psychiatry"" (4 min, 28 sec)", , ,,,, ,William Seward Burroughs Papers,,,,,,,,,,,,,,,,,, ,"Dates inferred from the fact that the original audio tape includes an unidentified British radio program, suggesting that the recording was made during the time Burroughs lived in London (c. 1960-1972).",,,,,,,,,,Original Format: Reel-to-reel audio tape|Duration: 00:04:28,
 , , , ,filename,exterminator.mp3, ,"""Naked Lunch"": the First Fifty Years","William Burroughs Reads from ""Naked Lunch:"" ""The Exterminator Does a Good Job""", , , ,2574,probably 1960 - 1972,original_format, ,sound recordings, , ,"Rare Book and Manuscript Library, Columbia University",inferred,local, , ,Sound,https://exhibitions.library.columbia.edu/exhibits/show/nakedlunch/nlreading/nlreading, ,English,iso639-2,reformatted digital, ,"Burroughs, William S., 1914-1997", , , , , ,"William Burroughs reading an excerpt from <em>Naked Lunch</em>: ""The Exterminator Does a Good Job"" (5 min, 45 sec)", , ,,,, ,William Seward Burroughs Papers,,,,,,,,,,,,,,,,,, ,"Dates inferred from the fact that the original audio tape includes an unidentified British radio program, suggesting that the recording was made during the time Burroughs lived in London (c. 1960-1972).",,,,,,,,,,Original Format: Reel-to-reel audio tape|Duration: 00:05:45,
 , , , ,filename,090069059.jpg, ,"""Naked Lunch"": the First Fifty Years","Howl, and other poems, Dedication", , , ,1301,1956,, ,books, , ,"Rare Book and Manuscript Library, Columbia University",inferred,local, , ,,https://exhibitions.library.columbia.edu/exhibits/show/nakedlunch/nlmanuscript/nlmss, ,English,iso639-2,reformatted digital, ,"Ginsberg, Allen, 1926-1997", , , , , ,, , ,San Francisco,1956,City Lights,,,, , , , ,"Kerouac, Jack, 1922-1969|Burroughs, William S., 1914-1997|Cassady, Neal|Carr, Lucien, 1925-2005", , , , , , , , , , , ,,,,,,,,,,,,,
 , , , ,filename,090069057.jpg, ,"""Naked Lunch"": the First Fifty Years","Junky, title page", , , ,1300,"1977|May 12, 1987",, ,books, , ,"Rare Book and Manuscript Library, Columbia University",exact,local, , ,,https://exhibitions.library.columbia.edu/exhibits/show/nakedlunch/junky/junkie, ,English,iso639-2,reformatted digital, ,"Burroughs, William S., 1914-1997 |Lowe, Steve", , , , , ,"Title page includes an inscription by William Burroughs to Steve Lowe, Lawrence, Kansas, May 12, 1987.", , ,New York,1977,Penguin Books,,,,,,,,,,,,,,,,,,,,,,,,holdings, ,CLIO id: 7201607,PS3552.U75 J86 1977, , ,original,,Junkie
 , , , ,filename,burroughsvideo.mp4, ,"""Naked Lunch"": the First Fifty Years",Dream Machine. Video, , , ,1072,2009,original_format, ,video recordings|objects, , ,"Rare Book and Manuscript Library, Columbia University",exact,local, , ,Moving Image,https://exhibitions.library.columbia.edu/exhibits/show/nakedlunch/dreammachine/burroughs-the-dream-machine, ,English,iso639-2,reformatted digital, ,"Govenar, Alan B., 1952- |Burroughs, William S., 1914-1997 |Gysin, Brion|Sommerville, Ian", , , , , ,"The Dream Machine, a device designed by Burroughs and Brion Gysin and constructed by Ian Sommerville, was designed to help stimulate brain activity and bring about a hallucinatory state. 

Alan Govenar directed this short video showing the Dream Machine in operation.

", , ,,,,,,,,,,,,,,,,,,,,,,,,,,,,,,,,,,"Duration: 00:03:08|Producer: Documentary Arts|Director: Govenar, Alan B., 1952- ",
 , , , ,filename,rube.mp3, ,"""Naked Lunch"": the First Fifty Years","William Burroughs Reads from ""Naked Lunch:"" ""The Rube""", , , ,1071,probably 1960 - 1972,original_format, ,sound recordings, , ,"Rare Book and Manuscript Library, Columbia University",inferred,local, , ,Sound,https://exhibitions.library.columbia.edu/exhibits/show/nakedlunch/nlreading/nlreading, ,English,iso639-2,reformatted digital, ,"Burroughs, William S., 1914-1997", , , , , ,"William Burroughs reading three excerpts from <em>Naked Lunch</em>: ""The Rube"" (22 min, 36 sec)", , ,,,, ,William Seward Burroughs Papers,,,,,,,,,,,,,,,,,, ,"Dates inferred from the fact that the original audio tape includes an unidentified British radio program, suggesting that the recording was made during the time Burroughs lived in London (c. 1960-1972).",,,,,,,,,,Original Format: Reel-to-reel audio tape|Duration: 00:22:36,
 , , , ,filename,090069058.jpg, ,"""Naked Lunch"": the First Fifty Years","Howl, and other poems, front cover", , , ,1070,1956,original_format, ,books, , ,"Rare Book and Manuscript Library, Columbia University",inferred,local, , ,Still Image,https://exhibitions.library.columbia.edu/exhibits/show/nakedlunch/nlmanuscript/nlmss, ,English,iso639-2,reformatted digital, ,"Ginsberg, Allen, 1926-1997", , , , , ,, , ,San Francisco,1956,City Lights,,,,,,,,,,,,,,,,,,,,,,related_item,"Pocket Poets Series, Number Four",,,,,,,,,
 , , , ,filename,090069056.jpg, ,"""Naked Lunch"": the First Fifty Years","Junky, front cover", , , ,1069,1977,original_format, ,books, , ,"Rare Book and Manuscript Library, Columbia University",inferred,local, , ,Still Image,https://exhibitions.library.columbia.edu/exhibits/show/nakedlunch/junky/junkie, ,English,iso639-2,reformatted digital, ,"Burroughs, William S., 1914-1997 ", , , , , ,, , ,New York,1977,Penguin,,,,,,,,,,,,,,,,,,,,,,,,,,,,,,,,
 , , , ,filename,090069054.jpg|090069055.jpg, ,"""Naked Lunch"": the First Fifty Years","Typed letter signed, William S. Burroughs to Allen Ginsberg", , , ,1068,"October 19, 1957",original_format, ,correspondence, , ,"Rare Book and Manuscript Library, Columbia University",exact,local, , ,Still Image,https://exhibitions.library.columbia.edu/exhibits/show/nakedlunch/nlmanuscript/nlmss, ,English,iso639-2,reformatted digital, ,"Burroughs, William S., 1914-1997 |Ginsberg, Allen, 1926-1997 ", , , , , ,,,,,,, ,Allen Ginsberg papers,"Tangiers, Morocco",,,,,,,,,,,,,,,,,,,,,,,,,,,,,
 , , , ,filename,090069052.jpg, ,"""Naked Lunch"": the First Fifty Years",Self Portrait, , , ,1067,1959,original_format, ,paintings, , ,"Rare Book and Manuscript Library, Columbia University",inferred,local, , ,Still Image,https://exhibitions.library.columbia.edu/exhibits/show/nakedlunch/dreammachine/burroughs-the-dream-machine, ,English,iso639-2,reformatted digital, ,"Burroughs, William S., 1914-1997 ", , , , , ,,,,,,,,,, , , , ,"Burroughs, William S., 1914-1997 ", , , , , , , , , , , , ,"The precise date and circumstances of the work’s creation are not known, but it was likely drawn around the time of Naked Lunch’s composition.",,,,,,,,,,,
 , , , ,filename,090069051.jpg, ,"""Naked Lunch"": the First Fifty Years","William S. Burroughs, London 1972", , , ,1066,1972,original_format, ,photographs, , ,"Rare Book and Manuscript Library, Columbia University",exact,local, , ,Still Image,https://exhibitions.library.columbia.edu/exhibits/show/nakedlunch/nlphotographs/photos, ,English,iso639-2,reformatted digital, ,"Charters, Ann", , , , , ,,,,,,, ,William Seward Burroughs Papers,London, , , , ,"Burroughs, William S., 1914-1997 ", , , , , , , , , , , ,,,,,,,,,,,,,
 , , , ,filename,090069050.jpg, ,"""Naked Lunch"": the First Fifty Years","Naked Lunch, front cover and slipcase front", , , ,1065,1984,original_format, ,books, , ,"Rare Book and Manuscript Library, Columbia University",exact,local, , ,Still Image,https://exhibitions.library.columbia.edu/exhibits/show/nakedlunch/nlbook/nlbooks2, ,English,iso639-2,reformatted digital, ,"Burroughs, William S., 1914-1997 ", , , , , ,25 anniversary edition cover and slipcover,,,New York,1984,Grove Press,,,,,,,,,,,,,,,,,,,, ,"25th anniversary ed., signed and limited. With prefixed leaf stating ""The twenty-fifth anniversary edition ... was printed as 500 signed slipcased copies.",,,holdings, ,CLIO id: 7195580,PS3552.U75 N3 1984, , ,,,
 , , , ,filename,090069049.jpg, ,"""Naked Lunch"": the First Fifty Years","Naked Lunch, title page", , , ,1064,1984,original_format, ,books, , ,"Rare Book and Manuscript Library, Columbia University",exact,local, , ,Still Image,https://exhibitions.library.columbia.edu/exhibits/show/nakedlunch/nlbook/nlbooks2, ,English,iso639-2,reformatted digital, ,"Burroughs, William S., 1914-1997", , , , , ,Twenty-fifth anniversary edition, , ,New York,1984,Grove Press,,,,,,,,,,,,,,,,,,,, ,"25th anniversary ed., signed and limited. With prefixed leaf stating ""The twenty-fifth anniversary edition ... was printed as 500 signed slipcased copies.",,,holdings, ,CLIO id: 7195580,PS3552.U75 N3 1984, , ,,,
 , , , ,filename,090069047.jpg|090069048.jpg, ,"""Naked Lunch"": the First Fifty Years","Interzone, front cover and title page", , , ,1063,1989,original_format, ,books, , ,"Rare Book and Manuscript Library, Columbia University",exact,local, , ,Still Image,https://exhibitions.library.columbia.edu/exhibits/show/nakedlunch/nlbook/nlbooks2, ,English,iso639-2,reformatted digital, ,"Burroughs, William S., 1914-1997|Grauerholz, James", , , , , ,, , ,New York,1989,Viking,,,,,,,,,,,,,,,,,,,, ,Title page is signed and dated by Burroughs.,,,holdings, ,CLIO id: 725962,PS3552.U75 I5 1989, , ,,,
 , , , ,filename,090069046.jpg, ,"""Naked Lunch"": the First Fifty Years","Dead Fingers Talk, front free endpaper", , , ,1062,1963,original_format, ,books, , ,"Rare Book and Manuscript Library, Columbia University",exact,local, , ,Still Image,https://exhibitions.library.columbia.edu/exhibits/show/nakedlunch/nlbook/nlbooks1, ,English,iso639-2,reformatted digital, ,"Burroughs, William S., 1914-1997 |Ginsberg, Allen, 1926-1997 ", , , , , ,, , ,London,1963,John Calder ,,,,,,,,,,,,,,,,,,,, ,"Allen Ginsberg's copy, with his autograph and three fishes insignia. Signed May 19, 1964.",,,holdings, ,CLIO id: 5543905,B812B945 P53 1963, , ,,,
 , , , ,filename,090069045.jpg, ,"""Naked Lunch"": the First Fifty Years","Naked Lunch, the Restored text, front cover", , , ,1061,2003,original_format, ,books, , ,"Rare Book and Manuscript Library, Columbia University",exact,local, , ,Still Image,https://exhibitions.library.columbia.edu/exhibits/show/nakedlunch/nlbook/nlbooks2, ,English,iso639-2,reformatted digital, ,"Burroughs, William S., 1914-1997 |Grauerholz, James|Miles, Barry, 1943-", , , , , ,, , ,New York,2003,Grove Press,,,,,,,,,,,,,,,,,,,,,,,,,,,,,,,,
 , , , ,filename,090069044.jpg, ,"""Naked Lunch"": the First Fifty Years","Naked Lunch, front cover", , , ,1060,1966,original_format, ,books, , ,"Rare Book and Manuscript Library, Columbia University",exact,local, , ,Still Image,https://exhibitions.library.columbia.edu/exhibits/show/nakedlunch/nlbook/nlbooks1, ,English,iso639-2,reformatted digital, ,"Burroughs, William S., 1914-1997", , , , , ,, , ,New York,1966,Evergreen,,,,,,,,,,,,,,,,,,,,,,,,,,,,,,,,
 , , , ,filename,090069043.jpg, ,"""Naked Lunch"": the First Fifty Years","Have You Seen Pantapon Rose?, page 4", , , ,1059,1958,original_format, ,periodicals, , ,"Rare Book and Manuscript Library, Columbia University",inferred,local, , ,Still Image,https://exhibitions.library.columbia.edu/exhibits/show/nakedlunch/nlperiodicals/nlperiodicals, ,English,iso639-2,reformatted digital, ,"Burroughs, William S., 1914-1997 |Baraka, Amiri, 1934-2014|Jones, Hettie", , , , , ,"First page of text by Burroughs in Yūgen, a magazine edited by LeRoi Jones and Hettie Cohen.", , ,New York,1958,ed. LeRoi Jones; Hettie Cohen,,,,,,,,,,,,,,,,,,,,,,,,,,,,,,original,,Yūgen
 , , , ,filename,090069041.jpg, ,"""Naked Lunch"": the First Fifty Years","Olympia: a Monthly Review from Paris, Number Two, front cover", , , ,1058,1962,original_format, ,periodicals, , ,"Rare Book and Manuscript Library, Columbia University",inferred,local, , ,Still Image,https://exhibitions.library.columbia.edu/exhibits/show/nakedlunch/dreammachine/burroughs-the-dream-machine, ,English,iso639-2,reformatted digital, ,"Olympia Press (Paris, France)", , , , , ,Front cover includes a photo of Ian Sommerville and Brion Gysin with the Dream Machine, , ,Paris,1962,"Olympia Press (Paris, France)",,,, , , , ,"Dream Machine|Sommerville, Ian|Gysin, Brion", , , , , , , , , , , ,,,,,,,,,,,,,
 , , , ,filename,090069039.jpg, ,"""Naked Lunch"": the First Fifty Years","Chicago Review, Spring 1958, front cover", , , ,1057,Spring 1958,original_format, ,periodicals, , ,"Rare Book and Manuscript Library, Columbia University",exact,local, , ,Still Image,https://exhibitions.library.columbia.edu/exhibits/show/nakedlunch/nlperiodicals/nlperiodicals, ,English,iso639-2,reformatted digital, ,"Hamburger, Michael|Vigneron, Robert", , , , , ,Issue title: Ten San Francisco Poets, , ,Chicago,1958-03 1958-05,,,,, , , , ,"Burroughs, William S., 1914-1997|Doyle, Kirby|Duncan, Robert, 1919-1988|Ferlinghetti, Lawrence|Ginsberg, Allen, 1926-1997|Kerouac, Jack, 1922-1969|Lamantia, Philip, 1927-2005|McClure, Michael|Whalen, Philip|Wieners, John, 1934-2002", , , , , , , , , , , ,,,,,,,,,,,original,,Chicago Review
 , , , ,filename,090069038.jpg, ,"""Naked Lunch"": the First Fifty Years","Traveller's Companion: no. 76, Naked Lunch, front cover", , , ,1056,[1959],original_format, ,books, , ,"Rare Book and Manuscript Library, Columbia University",inferred,local, , ,Still Image,https://exhibitions.library.columbia.edu/exhibits/show/nakedlunch/nlbook/nlbooks1, ,English,iso639-2,reformatted digital, ,"Burroughs, William S., 1914-1997", , , , , ,,,,Paris,1959,Olympia Press,,,,,,,,,,,,,,,,,,,,,,related_item,"Burroughs, William S., 1914-1997. Naked lunch",,,,,,,,,
 , , , ,filename,090069037.jpg, ,"""Naked Lunch"": the First Fifty Years","Traveller's Companion: no. 76, Naked Lunch, dust jacket front cover", , , ,1055,[1959],original_format, ,books, , ,"Rare Book and Manuscript Library, Columbia University",inferred,local, , ,Still Image,https://exhibitions.library.columbia.edu/exhibits/show/nakedlunch/nlbook/nlbooks1, ,English,iso639-2,reformatted digital, ,"Burroughs, William S., 1914-1997", , , , , ,, , ,Paris,1959,Olympia Press,,,,,,,,,,,,,,,,,,,,,,related_item,"Burroughs, William S., 1914-1997. Naked lunch",,,,,,,,,
 , , , ,filename,090069036.jpg, ,"""Naked Lunch"": the First Fifty Years","Narcotic Agent, front cover", , , ,1054,1953,original_format, ,books, , ,"Rare Book and Manuscript Library, Columbia University",inferred,local, , ,Still Image,https://exhibitions.library.columbia.edu/exhibits/show/nakedlunch/junky/junkie, ,English,iso639-2,reformatted digital, ,"Helbrant, Maurice", , , , , ,Cover of book bound dos-à-dos with Junkie by William Lee (pseudonym for William S. Burroughs)., , ,New York,1953,Ace Books,,,,,,,,,,,,,,,,,,,,,,related_item,Junkie: Confessions of an Unredeemed Drug Addict / William Lee,,,,,,,,,
 , , , ,filename,090069035.jpg, ,"""Naked Lunch"": the First Fifty Years","Junkie: Confessions of an Unredeemed Drug Addict, front cover", , , ,1053,1953,original_format, ,books, , ,"Rare Book and Manuscript Library, Columbia University",inferred,local, , ,Still Image,https://exhibitions.library.columbia.edu/exhibits/show/nakedlunch/junky/junkie, ,English,iso639-2,reformatted digital, ,"Burroughs, William S., 1914-1997", , , , , ,Cover of book bound dos-à-dos with Narcotic Agent by Maurice Helbrant (pseudonym for William S. Burroughs)., , ,New York,1953,Ace Books,,,,,,,,,,,,,,,,,,,,,,related_item,Narcotic Agent / Maurice Helbrant,,,,,,,,,
 , , , ,filename,090069034.jpg, ,"""Naked Lunch"": the First Fifty Years","Chicago Review: Autumn 1958, front cover", , , ,1052,Autumn 1958,original_format, ,periodicals, , ,"Rare Book and Manuscript Library, Columbia University",exact,local, , ,Still Image,https://exhibitions.library.columbia.edu/exhibits/show/nakedlunch/nlperiodicals/nlperiodicals, ,English,iso639-2,reformatted digital,,,,,,,,"Autumn 1958 issue, focusing on Naked Lunch / William S. Burroughs", , ,Chicago,1958-09 1958-11,,,,, , , , ," Burroughs, William S., 1914-1997. Naked lunch", , , , , , , , , , , ,,,related_item,"Burroughs, William S., 1914-1997. Naked lunch",,,,,,,,,
 , , , ,filename,090069033.jpg, ,"""Naked Lunch"": the First Fifty Years","Naked Lunch, front cover", , , ,1051,"[1962, c1959]",original_format, ,books, , ,"Rare Book and Manuscript Library, Columbia University",inferred,local, , ,Still Image,https://exhibitions.library.columbia.edu/exhibits/show/nakedlunch/nlbook/nlbooks1, ,English,iso639-2,reformatted digital, ,"Burroughs, William S., 1914-1997", , , , , ,, , ,New York,1962,Grove Press,,,,,,,,,,,,,,,,,,,,,,,,,,,,,,,,
 , , , ,filename,090069032.jpg, ,"""Naked Lunch"": the First Fifty Years","Big Table: 1, front cover", , , ,1050,Spring 1959,original_format, ,periodicals, , ,"Rare Book and Manuscript Library, Columbia University",inferred,local, , ,Still Image,https://exhibitions.library.columbia.edu/exhibits/show/nakedlunch/nlperiodicals/nlperiodicals, ,English,iso639-2,reformatted digital,,,,,,,,Issue 1 (Spring 1959) of Big Table, , ,Chicago,1959-03 1959-05,,,,, , , , ,"Kerouac, Jack, 1922-1969|Dahlberg, Edward, 1900-1977|Burroughs, William S., 1914-1997|Corso, Gregory", , , , , , , , , , , ,,,related_item,"Burroughs, William S., 1914-1997. Naked lunch",,,,,,,,,
 , , , ,filename,090069031.jpg, ,"""Naked Lunch"": the First Fifty Years","Doctor Benway : a passage from the Naked Lunch, front cover", , , ,1049,1979,original_format, ,books, , ,"Rare Book and Manuscript Library, Columbia University",inferred,local, , ,Still Image,https://exhibitions.library.columbia.edu/exhibits/show/nakedlunch/nlperiodicals/nlperiodicals, ,English,iso639-2,reformatted digital, ,"Burroughs, William S., 1914-1997", , , , , ,, , ,Santa Barbara,1979,B. Morrow,,,,,,,,,,,,,,,,,,,,,,related_item,"Burroughs, William S., 1914-1997. Naked lunch",,,,,,,,,
