 , , , ,original_format,filename,holdings, ,https://exhibitions-dev.library.columbia.edu/1900200006.jpg, ,"original filename:1900200006|Text in Latin includes both Emser's and Luther's works on the Leipzig Disputation|Woodcut of coat of arms of H. Emser on title page|recto, title page",Wild Boar in the Vinyard: Martin Luther at the Birth of the Modern World, , , ,[30] pages ; 21 cm (quarto),"Emser, Hieronymus, 1478-1527|Luther, Martin, 1483-1546. Ad aegocerotem Lutheri additio", ,pamphlets,Still Image,"De disputatione lipsicensi quantum ad Boemos obiter deflexa est Epistola / Hieronymi Emser. Ad Aegocerotem / Lutheri additio; Title page recto|On the Leipzig Disputation, an Epistle Which Turns on the Issue of the Bohemians [=Hussites]", , , ,fast, , , , ,Latin,"Burke Library at Union Theological Seminary, Columbia University",Union Rare Pamphlets,iso639-2,local, , , ,reformatted digital, ,4582893, ,[Augsburg],11371,Still Image, ,[1519],No Copyright - United States,LH34 1519, , ,Silvan Otmar,https://exhibitions.library.columbia.edu/exhibits/show/martin-luther/indulgences/leipzig, , , , ,"Catholic Church--Doctrines|Theology, Doctrinal|Leipzig Disputation (Germany : 1519)|Hussites", , , , , , , , , , , ,"Emser was one of Luther’s antagonists in this period and he referred to him as ""Goat Emser."" This work summarizes the debate that occurred in Leipzig between Luther and his opponents. Chief among these was Johann Eck, one of the leading intellects of the day who, in the course of the debate got Luther to admit (partial) support for the Bohemian theologian Jan Hus, who had notoriously been condemned as a heretic despite receiving a safe-conduct from the emperor, and was executed at Constance in 1415. The event, during which Luther asserted that ""scripture alone"" (sola scriptura) rather than the Roman Church or the Pope, was the supreme authority for Christians, marked a turning point in Luther’s relation to the Church of which he was then, still, a member. Soon after, the papal bull Exsurge Domine was issued, condemning Luther’s writings and setting the stage for his excommunication.",,,,,
 , , , ,original_format,filename,holdings, ,https://exhibitions-dev.library.columbia.edu/1900200005.jpg, ,"original filename:1900200005|Imprint from VD 16; date from colophon|Signatures: [A]-B⁴ (-B4)|recto, title page",Wild Boar in the Vinyard: Martin Luther at the Birth of the Modern World, , , ,[16] pages (last [2] pages blank) ; 21 cm (quarto),"Luther, Martin, 1483-1546|Gutknecht, Jobst, -1542", ,pamphlets,Still Image,"Ein freyheyt des Sermons Bebstlichen ablass vn[d] gnad belangend / Doctoris Martini Luther, wider die vorlegu[n]g So zu schmach sein vnd desselben Sermons erdichtet; Title page recto|Sermon on Indulgences and Grace", , , ,fast, , , , ,German,"Burke Library at Union Theological Seminary, Columbia University",Tower,iso639-2,local, , , ,reformatted digital, ,4528400, ,[Nürnberg],11370,Still Image, ,1518,No Copyright - United States,03-B1950, , ,[Jobst Gutknecht],https://exhibitions.library.columbia.edu/exhibits/show/martin-luther/indulgences/sermon-on-indulgences-and-grac, , , , ,Indulgences, , , , , , , , , , , ,"This very popular work, Luther’s first important publication in German, appeared in spring 1518 and further develops the arguments of the Ninety-five Theses concerning the inadequacies of the indulgence system. At this date there was just a single printer in Wittenberg who was underprepared for the huge market Luther’s writings generated. To meet the demand, many of Luther’s works were printed or re-printed in other cities with more developed printing industries such as Leipzig, Augsburg, Basel, and (as here) Nuremberg.  The sermon’s final passage captures the combative tone that would characterize some of Luther’s polemical works: ""...some people reproach me as a heretic (for such a truth is quite injurious for their money boxes), I pay little heed to such babblings [and the only ones who do are] some muddled brains who have never sniffed a Bible, have never read the Christian teachers, have never understood their own teachers but rather are decaying in their riddled and fragmented opinions. For if they had understood them, they would know that they should defame no one without hearing and challenging him. Nonetheless, may God give them and us right understanding. Amen.""",,,,,
 , , , ,original_format,filename,holdings, ,https://exhibitions-dev.library.columbia.edu/1900200004.jpg, ,"original filename:1900200004|Imprint from BM STC German, 1455-1600, p. 798|Edmond, J.P. has imprint Augsburg : Sylvan Otmar|Signatures: A⁶|Woodcut on title page depicting the selling of indulgences; initial|recto, title page",Wild Boar in the Vinyard: Martin Luther at the Birth of the Modern World, , , ,[12] pages ; 21 cm (quarto),"Schwalb, Hans", ,pamphlets|prints,Still Image,"Beclagung aines Leyens genant Hanns Schwalb über vil missbreüch christliches Lebens : vnd darin[n] begriffen kürtzlich von Johannes Husssen [sic]; Title page recto|Lament of Lay Person Named Hans Schwalb Over Many Abuses of the Christian Life, and Therein is a Brief Explanation About Jan Hus
", , , ,fast, , , , ,German,"Burke Library at Union Theological Seminary, Columbia University",Tower,iso639-2,local, , , ,reformatted digital, ,6120388, ,[Augsburg],11369,Still Image, ,im Jar 1521,No Copyright - United States,07-B002, , ,[Melchoir Ramminger],, , , , ,"Hus, Jan, 1369?-1415|Luther, Martin, 1483-1546|Catholic Church", , , , , , , , , , , ,The woodcut depicts the selling of indulgences.,,,,,
 , , , ,original_format,filename,holdings, ,https://exhibitions-dev.library.columbia.edu/1900200003.jpg, ,"original filename:1900200003|Signatures: a¹²|Not paginated or foliated|""Datum Rome apud sanctum Petrum anno incarnationis dominice Millesimo quinge[n]tesimo tercio Non[as] Octob[ris], pontificatus nostri Anno Nono""--Foot of leaf [a12r])|Summary by papal legate Cardinal Raimond Pérault of bull Domini et Salvatoris, issued 5 Oct. 1500|""[Cardinal] Peraudi left Rome on his legatine mission on 26 October (1500) to announce the jubilee and crusading indulgences. He carried with him the crusading bull Domini et salvatoris (dated 5 October, 1500).""--K.M. Setton, The papacy and the Levant, 1204-1571 (Philadelphia: American Philosophical Society, 1978), v. 2, p. 531-532|Imprint from ISTC|Burke Library copy: Imperfect, leaf [a1] (blank?) wanting|Burke Library copy: Rubricated throughout. Some annotations|recto, title page",Wild Boar in the Vinyard: Martin Luther at the Birth of the Modern World, , , ,[12] leaves ; 27 cm (folio),"Catholic Church. Pope (1492-1503 : Alexander VI)|Pérault, Raimond, 1435-1505|Schöffer, Peter, approximately 1425-approximately 1502|Catholic Church. Pope (1492-1503 : Alexander VI). Domini et salvatoris (5 Oct. 1500)", ,pamphlets,Still Image,Summaria declaratio bulle indulgentia[rum] sacratissima[rum]; Title page recto|Summary Declaration of a Bull of Indulgences Against the Turks, , , ,fast, , , , ,Latin,"Burke Library at Union Theological Seminary, Columbia University",Van Ess 2,iso639-2,local, , , ,reformatted digital, ,4662747, ,[Mainz],11368,Still Image, ,[ca. 1500 to 1503],No Copyright - United States,4, , ,[Peter Schöffer],https://exhibitions.library.columbia.edu/exhibits/show/martin-luther/indulgences/summary, , , , ,"Bulls, Papal|Indulgences|Crusade bulls", , , , , , , , , , , ,"Printed by Gutenburg’s associate Peter Schöffer, possibly for one of the more successful indulgence sellers, Raymond Peraudi. The document enumerates a variety of indulgences available for those who would support a crusade against the Ottoman Empire, which at that point reached well into the Balkan Peninsula to the frontier of the Holy Roman Empire and Luther’s Germany.", ,"Van Ess Collection (Burke Library, Union Theological Seminary)",,,questionable
 , , , ,original_format,filename,holdings, ,https://exhibitions-dev.library.columbia.edu/1900200002.jpg, ,"original filename:1900200002|Ad lectorem/ Aethereas edes tibi cure est optime lector/ Scandere nos emito namq[uam] damus semitam.""|Imprint from colophon|Author's name appears on leaf A3: ""Frater Johannes De Paltz sacre theologie hu[m]ilis p[ro]fessor ordinis fratru[m] heremitarum s[an]cti Augustini Reuerentia debita[m].""|Signatures: A-V⁶ X⁴ Y⁶; Y6 blank|Woodcut (depicting the Crucifixion) on title page|Burke Library copy: Rubrication throughout, including on woodcut image of Christ on the cross. Binding includes metal clasps|recto, title page",Wild Boar in the Vinyard: Martin Luther at the Birth of the Modern World, , , ,[260] pages : illustrations (woodcut) ; 22 cm (quarto),"Paltz, Johann von, -1511|Schenck, Wolfgang, active 1498-1507", ,books|prints,Still Image,Celifodina; Title page recto, , , ,fast, , , , ,Latin,"Burke Library at Union Theological Seminary, Columbia University",Tower,iso639-2,local, , , ,reformatted digital, ,5465079, ,Impressum Erphordie [Erfurt],11367,Still Image, ,"anno MDII, tertia post Judica [1502]",No Copyright - United States,BT450 .P35 1502g, , ,P[er] Wolffgangu[m] Schencken,https://exhibitions.library.columbia.edu/exhibits/show/martin-luther/indulgences/celifodina, , , , ,Crucifixion of Jesus Christ|Christian life--Catholic authors, , , , , , , , , , , ,"This work of pastoral guidance was written by Johann von Paltz (c. 1445 – 1511), an Augustinian friar and one of Luther’s superiors and (possibly) mentors. He wrote extensively about indulgences in a theologically correct way, but was loyal to the Church. The woodcut shows friars ""digging"" in the Scriptures for the hidden truths of the Christian faith.",,,,,
 , , , ,original_format,filename,holdings, ,https://exhibitions-dev.library.columbia.edu/1900200001.jpg, ,"original filename:1900200001|Imprint from colophon which reads: ""Impressum Liptzk per Cunradun Kachelosen Anno domini Millesimoquadringentesimo Nonagelimoquinto.""|Signatures: A⁸ B-C⁶ (-A1)|Title page missing|Boxed in Van Ess Collection under ""Franciscans; Privilegia ...""|recto, title page",Wild Boar in the Vinyard: Martin Luther at the Birth of the Modern World, , , ,[40] pages ; 21 cm (octavo),"Kachelofen, Konrad, -1528 or 1529", ,pamphlets,Still Image,Priuilegia et indulgentia fratrum minoru[m] ordinis Sancti francisci; Title page recto|Privileges and Indulgences of the Franciscan Order , , , ,fast, , , , ,Latin,"Burke Library at Union Theological Seminary, Columbia University",Van Ess 1,iso639-2,local, , , ,reformatted digital, ,4528469, ,Impressum Liptzk,11366,Still Image, ,[1495],No Copyright - United States,91, , ,per Cunradun Kachelofen,https://exhibitions.library.columbia.edu/exhibits/show/martin-luther/indulgences/privileges, , , , ,"Franciscans|Indulgences (Canon law)|Privileges and immunities, Ecclesiastical", , , , , , , , , , , ,"This document summarizes indulgences granted to members of the mendicant Order of St. Francis, the benefits of which might be conveyed to those who visited their churches.",,,,,
