 , , , ,original_format,filename,holdings, ,https://exhibitions-dev.library.columbia.edu/1900200039.jpg, ,"original filename:1900200039|Woodcut on title page|recto, title page",Wild Boar in the Vinyard: Martin Luther at the Birth of the Modern World, , , ,22 pages (quarto) ; cm,"Luther, Martin, 1483-1546", ,pamphlets|prints,Still Image,"Eyn Sermõ von dẽ hochwirdigen Sacramẽt, des hyeligen waren Leychnamss Chrsiti. und võ den Bruderschafften / D.M.L.A; Title page recto|Blessed Sacrament of the Holy and True Body of Christ, and the Brotherhoods, 1519", , , ,fast, , , , ,German,"Burke Library at Union Theological Seminary, Columbia University",Union Rare,iso639-2,local, , , ,reformatted digital, ,4551082, ,Hat lassen drucken tzu Leyptzick [i.e. Leipzig,11405,Still Image, ,Im Tausent funffhunderten vnd ym tzwentzigsten iare. 1520],No Copyright - United States,GT2 1520ss, , ,Ualentinus Schuman. i.e. Valentin Schumann,https://exhibitions.library.columbia.edu/exhibits/show/martin-luther/theology/sacraments,,,,,,,,,,,,,,,,,"The woodcut illustration depicts the seven sacraments: baptism, confirmation, eucharist (holy communion), penance, marriage, priestly ordination, anointing of the sick.",,,,,
 , , , ,original_format,filename,holdings, ,https://exhibitions-dev.library.columbia.edu/1900200038.jpg, ,"original filename:1900200038|Title page with woodcut border by Hans Cranach|Initial|recto, title page",Wild Boar in the Vinyard: Martin Luther at the Birth of the Modern World, , , ,[87] pages ; 21 cm,"Luther, Martin, 1483-1546", ,books,Still Image,De captivitate babylonica ecclesiae / praeludium Martini Lutheri; Title page recto|On the Babylonian Captivity of the Church, , , ,fast, , , , ,Latin,"Burke Library at Union Theological Seminary, Columbia University",Union Rare Pamphlets,iso639-2,local, , , ,reformatted digital, ,4583009, ,Vuittembergae [i.e. Wittenberg,11404,Still Image, ,"6. Oktober, 1520]",No Copyright - United States,GT2 1520cb, , ,Melchior Lotter d.j.,https://exhibitions.library.columbia.edu/exhibits/show/martin-luther/theology/captivity, , , , ,Catholic Church|Controversial literature--Protestant authors, , , , , , , , , , , ,"Unlike his Open Letter to the Christian Nobility, this more theologically nuanced work is composed in Latin (though there were German editions) and addressed to a specialist audience in a more measured tone. Citing the Bible as evidence, Luther argues that the number of sacraments should be reduced from seven to three (and finally to two), thereby removing major pillars upon which the structure of the medieval way of life had been erected. In particular, he attacks the Church’s doctrine, which drew on Aristotelian categories, of the ""transubstantiation"" of bread and wine at Communion, instead insisting that ""the Holy Spirit is greater than Aristotle."" The work articulates ideas that would come to define many Protestant traditions, but also prove to be sources of ongoing division among them. ",,,,,
 , , , ,original_format,filename,holdings, ,https://exhibitions-dev.library.columbia.edu/1900200037.jpg, ,"original filename:1900200037|At end: Zů Wittenberg. Im Jar. M.D.XX. Durch jn selbs gemeret vnd corrigiert|recto, title page",Wild Boar in the Vinyard: Martin Luther at the Birth of the Modern World, , , ,[82] pages ; 20 cm,"Luther, Martin, 1483-1546", ,books,Still Image,An den Cristlichen Adel deütscher Nation : von des Christlichen stands besserũg / D. Martinus Luther; Title page recto|Open Letter to the Christian Nobility of the German Nation Concerning the Reform of Christian Society , , , ,fast, , , , ,German,"Burke Library at Union Theological Seminary, Columbia University",Union Rare,iso639-2,local, , , ,reformatted digital, ,4573077, ,Vuittenberg,11403,Still Image, ,[1520],No Copyright - United States,GT2 1520anf, , ,"[Druck von Renatus Beck, Strassburg",https://exhibitions.library.columbia.edu/exhibits/show/martin-luther/theology/nobility,,,,,,,,,,,,,,,,,,,,,,
 , , , ,original_format,filename,holdings, ,https://exhibitions-dev.library.columbia.edu/1900200036.jpg, ,"original filename:1900200036|Date of imprint on page [34]|Signatures: A-C[superscript 4], D[superscript 5]|recto, title page",Wild Boar in the Vinyard: Martin Luther at the Birth of the Modern World, , , ,[34] pages ; 19 cm,"Luther, Martin, 1483-1546", ,books,Still Image,"Epistola Lutheriana ad Leonem decimum summum pontificem  Tractatus de libertate Christiana; Title page recto|Letter of Martin Luther to Leo X, Supreme Pontiff: A Tract on Christian Liberty", , , ,fast, , , , ,Latin,"Burke Library at Union Theological Seminary, Columbia University",Union Rare Pamphlets,iso639-2,local, , , ,reformatted digital, ,4585559, ,Vuittembergae,11402,Still Image, ,[1520],No Copyright - United States,GT2 1520e, , ,[Johann Grünenberg,https://exhibitions.library.columbia.edu/exhibits/show/martin-luther/theology/authority,,,,,,,,,,,,,,,,,"In this preface to his key work On the Freedom of the Christian, Luther appeals directly to the Pope in his own defense and to address the failures of the Church. Luther is variously obsequious and brash in making his case:""Among those monstrous evils of this age with which I have now for three years been waging war, I am sometimes compelled to look to you and to call you to mind, most blessed father Leo. In truth, since you alone are everywhere considered as being the cause of my engaging in war, I cannot at any time fail to remember you; and although I have been compelled by the causeless raging of your impious flatterers against me to appeal from your seat to a future council...yet I have never been so alienated in feeling from your Blessedness as not to have sought with all my might, in diligent prayer and crying to God, all the best gifts for you and for your see. But those who have hitherto endeavored to terrify me with the majesty of your name and authority, I have begun quite to despise and triumph over.""",,,,,
 , , , ,original_format,filename,holdings, ,https://exhibitions-dev.library.columbia.edu/1900200035.jpg, ,"original filename:1900200035|recto, title page",Wild Boar in the Vinyard: Martin Luther at the Birth of the Modern World, , , ,[99] pages ; 20 cm (quarto),"Luther, Martin, 1483-1546|Lotter, Melchior, approximately 1490-", ,books,Still Image,An den Christlichen Adel deutscher Nation : von des Christlichen standes besserung / D. Martinus Luther. ..; Title page recto|Open Letter to the Christian Nobility of the German Nation Concerning the Reform of Christian Society , , , ,fast, , , , ,German,"Burke Library at Union Theological Seminary, Columbia University",Union Rare Pamphlets,iso639-2,local, , , ,reformatted digital, ,4551076, ,[Wittenberg],11401,Still Image, ,[1520],No Copyright - United States,GT2 1520anb, , ,Melchior Lotter d.J.,https://exhibitions.library.columbia.edu/exhibits/show/martin-luther/theology/nobility, , , , ,Church and state--Catholic Church|Church and state|Germany|Holy Roman Empire|History, , , , , , , , , , , ,"Luther here argues in German for a full-scale overhaul of the Church, and that the secular powers of emperor and nobility had the authority and the responsibility to act in the face of a corrupted Church, whose members he dismissively referred to as ""Romanists."" He called for the end of major swathes of the medieval Church’s structure, including its elaborate calendar of feasts and saints days, and its vast industry of relics and pilgrimages. Among his demands was the abolition of clerical celibacy, arguing that to prohibit marriage was as futile as to ""forbid eating, drinking, the natural movement of the bowels or growing fat."" Though addressed primarily to non-ecclesiastical elites – whose support and protection were perhaps the main reason he survived through this period – the work uses populist rhetoric against the hierarchy of Church structures and teaching. It was reprinted at least fourteen times within just a few years.  ""Therefore…those who are now called ‘spiritual’ – priests, bishops, or popes – are neither different from other Christians, nor superior to them….""  ""...there is no true, basic difference between laymen and priests, princes and bishops, between religious and secular, except for the sake of office and work, but not for the sake of status….they all of the spiritual estate, all are truly priests, bishops, and popes.""  ""...it may well happen that the pope and his followers are wicked men and not true Christians, not taught of God, not having true understanding. On the other hand, an ordinary man may have true understanding; why then should we not follow him?""",,,,,
 , , , ,original_format,filename,holdings, ,https://exhibitions-dev.library.columbia.edu/1900200034.jpg, ,"original filename:1900200034|Author hypothetically identified as Johannes de Francfordia. Cf. Lexikon für Theologie und Kirche. 2d ed., v. 10, column 62|""Vorrhede"" signed: Doctor Martinus Luther|Imprint from colophon; date in colophon: Nach Christ gepurt tausent funffhundert vnd zwentzigsten JAR. Am abent Sancti Michaelis|Signatures: A-H⁴ I⁶|Image on title page, woodcut of the resurrection of Adam|recto, title page",Wild Boar in the Vinyard: Martin Luther at the Birth of the Modern World, , , ,[76] pages ; 22 cm (quarto),"Franckforter|Luther, Martin, 1483-1546. Vorrede zu der vollständigen Ausgabe der Theologia Deutsch|Rhau-Grunenberg, Johann, active 1508-1525", ,books,Still Image,"Eyn Deutsch Theologia das is Eyn edles Büchleyn, von rechtem vorstandt, was Adam vnd Christus sey, vnd wie Adam yn vns sterben, vn[d] Christ ersteen sall; Title page recto|A German Theology, That is a Noble Booklet, That Rightly Understands What Adam and Christ Are, and How Adam Should Die and Christ Should Arise in Us", , , ,fast, , , , ,German,"Burke Library at Union Theological Seminary, Columbia University",Tower,iso639-2,local, , , ,reformatted digital, ,4528401, ,Gedruckt zu Wittenbergk,11400,Still Image, ,[1520],No Copyright - United States,03-B1951, , ,durch Joha[n]nem Grünenb,https://exhibitions.library.columbia.edu/exhibits/show/martin-luther/theology, , , , ,Christian life--Middle Ages|Mysticism|Germany, , , , , , , , , , , ,"Luther edited and wrote the preface to the Theologia Germanica. This anonymous 14th century mystical work enjoined union with God and self-renunciation and was a favorite of Luther’s. In addition to its theology, the fact that it was written in German energized Luther’s view that vernacular language could be a suitable medium for the transcendent. From the preface: ""...I will have every one warned who reads this little book, that he should not take offence, to his own hurt, at its bad German, or its crabbed and uncouth words. For this noble book, though it be poor and rude in words, is so much the richer and more precious in knowledge and divine wisdom…Let as many as will, read this little book, and then say whether theology is a new or an old thing among us; for this book is not new. But if they say as before, that we are but German theologians, we will not deny it. I thank God, that I have heard and found my God in the German tongue, as neither I nor they have yet found Him in the Latin, Greek, or Hebrew tongue. God grant that this book may be spread abroad, then we shall find that the German theologians are without doubt the best theologians.""",,,,,
 , , , ,original_format,filename,holdings, ,https://exhibitions-dev.library.columbia.edu/1900200033.jpg, ,"original filename:1900200033|Printer from colophon which reads: ""Gedruckt zu Wittemberg, durch Nickel Schirlentz. M.D.XXviij.""|Signatures: A-M⁴|""Vorrhede"" by Martin Luther|Title within woodcut border|Compare with 03-B1229 (VD 16, M 2604; Benzing, 2498; Gatch, D272) and 03-B1877 (VD 16, M 2603; Benzing, 2496; Gatch, D2039) and 03-B1878 (VD 16, M 2597; Benzing, 2488; Gatch, D2038)|recto, title page",Wild Boar in the Vinyard: Martin Luther at the Birth of the Modern World, , , ,[96] pages (last [2] pages blank) ; 20 cm (quarto),"Melanchthon, Philipp, 1497-1560|Luther, Martin, 1483-1546|Schirlentz, Nickel", ,books,Still Image,Vnterricht der Visitatorn an die Pfarhern ym Kurfurstenthum zu Sachssen; Title page recto, , , ,fast, , , , ,German,"Burke Library at Union Theological Seminary, Columbia University",Tower,iso639-2,local, , , ,reformatted digital, ,4528357, ,Vuittemberg,11399,Still Image, ,1528,No Copyright - United States,03-B1876, , ,Nickel Schirlentz,https://exhibitions.library.columbia.edu/exhibits/show/martin-luther/flug/flug3, , , , ,"Lutheran Church--Doctrines|Lutheran Church--Education|Visitations, Ecclesiastical|Saxony (Germany)|History", , , , , , , , , , , ,"This book represents the first attempt to organize the Reformation within a given territory. These are the ""Saxon Visitation Articles"", intended to guide the Saxon government representatives charged with bringing order, and raising the level of Christian education, within church and school -- is this in the CLIO record? Not sure of the source YES FROM CLIO SEE https://clio.columbia.edu/catalog/4528357",,,,,
 , , , ,original_format,filename,holdings, ,https://exhibitions-dev.library.columbia.edu/1900200032.jpg, ,"original filename:1900200032|Name of printer from colophon which reads: ""Gedruckt zu Wittemberg durch Nickel Schirlentz im Jar M D XXXII""|Signatures: A-F⁴ (-F4)|Title within historiated woodcut border|Compare with 03-B1553 (Benzing, 3030; VD 16, L 7580; Gatch, D812)|recto, title page",Wild Boar in the Vinyard: Martin Luther at the Birth of the Modern World, , , ,[48] pages (last leaf blank) ; 18 cm (quarto),"Luther, Martin, 1483-1546", ,books,Still Image,Zwo Predigt vber der Leiche des Kürfursten Hertzog Iohans zu Sachssen / D. Mart. Luthers; Title page recto, , , ,fast, , , , ,German,"Burke Library at Union Theological Seminary, Columbia University",Tower,iso639-2,local, , , ,reformatted digital, ,4527649, ,Wittemberg,11398,Still Image, ,1532,No Copyright - United States,03-B1201, , ,Nickel Schirlentz,https://exhibitions.library.columbia.edu/exhibits/show/martin-luther/flug/flug3, , , , ,"Johann, der Beständige, Elector of Saxony, 1468-1532|Lutheran Church", , , , , , , , , , , ,,,,,,
 , , , ,original_format,filename,holdings, ,https://exhibitions-dev.library.columbia.edu/1900200031.jpg, ,"original filename:1900200031|Printer from colophon which reads: ""Gedruckt zu Wittemberg durch Hans Lufft. M.D.XXXIII.""|Signatures: A-F⁴|Title within historiated woodcut border|recto, title page",Wild Boar in the Vinyard: Martin Luther at the Birth of the Modern World, , , ,[48] pages ; 19 cm (quarto),"Luther, Martin, 1483-1546|Johann Friedrich I, Kurfürst von Sachsen, 1503-1554", ,books,Still Image,"Eine Predigt Vom verloren Schaf, Luce. xv. / D. Mart. Luth. zu Wittemberg for dem Churfürsten zu Sachsten Herzog Johans fridrich rx. Gepredict; Title page recto|A Sermon on the Lost Sheep, Luke 15", , , ,fast, , , , ,German,"Burke Library at Union Theological Seminary, Columbia University",Tower,iso639-2,local, , , ,reformatted digital, ,4527647, ,"Wittemberg [i.e., Wittenberg]",11397,Still Image, ,M.D.XXXIII. [1523],No Copyright - United States,03-B1203, , ,Hans Lufft,https://exhibitions.library.columbia.edu/exhibits/show/martin-luther/flug/flug3, , , , ,"Bible. Luke, XV, 1-10|Lost sheep (Parable)", , , , , , , , , , , ,,,,,,
 , , , ,original_format,filename,holdings, ,https://exhibitions-dev.library.columbia.edu/1900200030.jpg, ,"original filename:1900200030|Title within ornamental border|Printer from colophon: ""Gedrückt zu Wittemberg durch Georgen Rhaw. 1533.""|Signatures: A-K⁴; A3 signed A5, I2 signed H2|recto, title page",Wild Boar in the Vinyard: Martin Luther at the Birth of the Modern World, , , ,[80] pages ; 19 cm (quarto),"Luther, Martin, 1483-1546|Rhaw, Georg, 1488-1548", ,books,Still Image,"Das Sechste Capitel der Epistel Pauli an de Epheser : Von der Christen harnisch vnd woffen / gepredigt durch D. Mart. Luther; Title page recto|The Sixth Chapter of Paul’s Epistle to the Ephesians, On the Christian Armor and Weapons", , , ,fast, , , , ,German,"Burke Library at Union Theological Seminary, Columbia University",Tower,iso639-2,local, , , ,reformatted digital, ,4527646, ,"Wittemberg [i.e., Wittenberg]",11396,Still Image, ,M.D.XXXIII. [1533],No Copyright - United States,03-B1204, , ,Georgen Rhaw,https://exhibitions.library.columbia.edu/exhibits/show/martin-luther/flug/flug3, , , , ,"Bible. Ephesians, VI", , , , , , , , , , , ,,,,,,
 , , , ,original_format,filename,holdings, ,https://exhibitions-dev.library.columbia.edu/1900200029.jpg, ,"original filename:1900200029|Imprint from colophon which reads ""Gedruck tzu Leypsick durch Ualentin Schuman anno. M.D.xix.""|Signatures: A-E⁶|Woodcuts on recto and verso of title page|Compare with 03-B1423 (VD 16, L 4058; Benzing, 274; Gatch, D667) and 03-B1863 (VD 16, L 4046; Benzing, 262; Gatch, D2013)|recto, title page",Wild Boar in the Vinyard: Martin Luther at the Birth of the Modern World, , , ,[60] pages ; 21 cm (quarto),"Luther, Martin, 1483-1546", ,books,Still Image,Auslegu[n]g deutsch des Vater vnser fuer die einfeltigen Leyen Doctoris Martini Luther Augustiner tzu Wittenbergk; Title page recto|An Exposition of the Lord‘s Prayer for Simple Laymen, , , ,fast, , , , ,German,"Burke Library at Union Theological Seminary, Columbia University",Tower,iso639-2,local, , , ,reformatted digital, ,4527572, ,"Leypsick [i.e., Leipzig]",11395,Still Image, ,M.D.xix. [1519],No Copyright - United States,03-B1166, , ,Ualentin Schuman,https://exhibitions.library.columbia.edu/exhibits/show/martin-luther/flug/flug3, , , , ,Lord's prayer, , , , , , , , , , , ,,,,,,
 , , , ,original_format,filename,holdings, ,https://exhibitions-dev.library.columbia.edu/1900200028.jpg, ,"original filename:1900200028|Prelim. signed: Martinus Luder .|Imprint from colophon|Signatures: A-B⁶ C⁴ D-E⁶ F⁴ G-H⁶ (H6 blank)|Woodcut illustration on title page of David kneeling in prayer, playing a harp on the ground below and God looking down from the clouds above|recto, title page",Wild Boar in the Vinyard: Martin Luther at the Birth of the Modern World, , , ,[88] leaves : illustrations (woodcut) ; 21 cm (quarto),"Luther, Martin, 1483-1546", ,books,Still Image,"Die Sieben buszpsalm mit deutscher auszlegung nach dem schrifftlichen synne tzu Christi vnd gottes gnaden, neben seyns selben. ware erkentniss. grundlich gerichtet; Title page recto|The Seven Penitential Psalms with German Expositions Following the Written Sense to the Grace of Christ and God", , , ,fast, , , , ,German,"Burke Library at Union Theological Seminary, Columbia University",Tower,iso639-2,local, , , ,reformatted digital, ,4527579, ,"Gedruckt tzu Leyptzk [i.e., Leipzig]",11394,Still Image, ,Nach Christ geburt Tausent funffhundert vnd ym newtzehenden yare. [1519],No Copyright - United States,03-B1147, , ,durch den vorsichtigen man Jacobum Thanner,https://exhibitions.library.columbia.edu/exhibits/show/martin-luther/flug/flug3, , , , ,Penitential Psalms|Bible. Psalms|Penance, , , , , , , , , , , ,,,,,,
 , , , ,original_format,filename,holdings, ,https://exhibitions-dev.library.columbia.edu/1900200027.jpg, ,"original filename:1900200027|Text in German includes Luther's translation of Psalm 37 (Vulgate Psalm 36). Cf. Luther, Works, 1883, vol. 8, p. 209|Imprint from colophon|Colophon: Gedruckt tzu Wittembergk Montag nach Laurentij 1521|LC call numbers: BR304.R44 no. 73; BS1450 37th|Signatures: A-D⁴|Title within illustrated woodcut border, alternative form of number 5 used in t.p. date|Woodcut illustration on title page verso of Mary wearing crown, facing left, holding the child Jesus, differs from that in LCCN 2001554663|Compare with 03-B1935 (VD 16, L 5872)|recto, title page",Wild Boar in the Vinyard: Martin Luther at the Birth of the Modern World, , , ,[32] pages : illustrations (woodcut) ; 19 cm (quarto),"Luther, Martin, 1483-1546", ,pamphlets,Still Image,"Der sechs vn[d] dreyssigist Psalm Dauid : eynen Christlichen Menschen tzu leren vn[d] trösten widder die Mütterey der böszenn vnnd freueln Gleyszner / Martinus Luther; Title page recto|The 36th Psalm of David, to Teach a Christian and Console Them Against the Wantonness of Evil and Haughty Hypocrites", , , ,fast, , , , ,German|Latin,"Burke Library at Union Theological Seminary, Columbia University",Tower,iso639-2,local, , , ,reformatted digital, ,4527553, ,[Wittenberg],11393,Still Image, ,1521,No Copyright - United States,03-B1129, , ,[Johann Rhau-Grunenberg],https://exhibitions.library.columbia.edu/exhibits/show/martin-luther/flug/flug2, , , , ,"Bible. Psalms, XXXVII|Reformation", , , , , , , , , , , ,,,,,,
 , , , ,original_format,filename,holdings, ,https://exhibitions-dev.library.columbia.edu/1900200026.jpg, ,"original filename:1900200026|Name of printer from colophon which reads: ""Gedruckt zu Wittemberg durh Hans Lufft""|Signatures: A-C⁴ D²|Title within historiated and architectural woodcut border|Compare with 03-B1531 (Benzing, 2428; VD 16, L 5513; Gatch, D761)|recto, title page",Wild Boar in the Vinyard: Martin Luther at the Birth of the Modern World, , , ,[28] pages ; 20 cm (quarto),"Luther, Martin, 1483-1546", ,pamphlets,Still Image,Ob man furdemster ben fliehen muge / Marti. Luther; Title page recto|Whether One May Flee from a Deadly Plague, , , ,fast, , , , ,German,"Burke Library at Union Theological Seminary, Columbia University",Tower,iso639-2,local, , , ,reformatted digital, ,4527574, ,"Wittemberg [i.e., Wittenberg]",11392,Still Image, ,M.D.XXVII. [1527],No Copyright - United States,03-B1164, , ,Hans Lufft,https://exhibitions.library.columbia.edu/exhibits/show/martin-luther/flug/flug2, , , , ,Christian ethics|Death--Religious aspects--Christianity, , , , , , , , , , , ,,,,,,
 , , , ,original_format,filename,holdings, ,https://exhibitions-dev.library.columbia.edu/1900200025.jpg, ,"original filename:1900200025|Signature: A⁴|recto, title page",Wild Boar in the Vinyard: Martin Luther at the Birth of the Modern World, , , ,[7] pages ; 20 cm (quarto),"Luther, Martin, 1483-1546", ,pamphlets,Still Image,"Eyn Sermon von dem newen gebornen Kindelein Ihesu gepredigt auft den Christag nach mit tag / Martinus Luther; Title page recto|A Sermon on the New Born Child, Jesus, Preached on Christmas Afternoon", , , ,fast, , , , ,German,"Burke Library at Union Theological Seminary, Columbia University",Tower,iso639-2,local, , , ,reformatted digital, ,4527529, ,Zwickaw :Jörg Gastel,11391,Still Image, ,1523,No Copyright - United States,03-B1121, , ,,https://exhibitions.library.columbia.edu/exhibits/show/martin-luther/flug/flug2, , , , ,Jesus Christ|Reformation, , , , , , , , , , , ,,,,,,
 , , , ,original_format,filename,holdings, ,https://exhibitions-dev.library.columbia.edu/1900200024.jpg, ,"original filename:1900200024|Signatures: A-B⁴|Title within woodcut border|recto, title page",Wild Boar in the Vinyard: Martin Luther at the Birth of the Modern World, , , ,[16] pages (last [2] pages blank) ; 18 cm (quarto),"Luther, Martin, 1483-1546", ,pamphlets,Still Image,"Eyn Sermon vber das Euangelium Johan. 4. : es war eyn Konigischer des Son lag kranck zu Capernaum etc / Martinus Luther. DMXXiij. Wyttem; Title page recto|Sermon on Gospel of John 4, the Royal Official’s Son at Capernaum", , , ,fast, , , , ,German,"Burke Library at Union Theological Seminary, Columbia University",Tower,iso639-2,local, , , ,reformatted digital, ,4527543, ,"Wyttem. [i.e., Wittenberg]",11390,Still Image, ,"DMXXiij [i.e., MDXXiij, 1523]",No Copyright - United States,03-B1135, , ,[Hans Lufft],https://exhibitions.library.columbia.edu/exhibits/show/martin-luther/flug/flug2, , , , ,"Bible. John, IV", , , , , , , , , , , ,,,,,,
 , , , ,original_format,filename,holdings, ,https://exhibitions-dev.library.columbia.edu/1900200023.jpg, ,"original filename:1900200023|Publisher statement from Benzing|Signatures: A-C⁴ [-C4] (Last three pages blank)|Title within historiated woodcut border attributed to school of Lucas Cranach d.Ä. Cf. Cranach im Detail: Buchschmuck Lucas Cranachs des Älteren und seiner Werkstatt, 1994, page 54|LC call number: BR332.S4 P4|recto, title page",Wild Boar in the Vinyard: Martin Luther at the Birth of the Modern World, , , ,[24] pages (the last [3] pages blank) ; 19 cm (quarto),"Luther, Martin, 1483-1546|Cranach, Lucas, 1472-1553", ,pamphlets,Still Image,Eyn Sermon auff den Pfingstag / Mart. Luther; Title page recto|A Sermon on Pentecost, , , ,fast, , , , ,German,"Burke Library at Union Theological Seminary, Columbia University",Tower,iso639-2,local, , , ,reformatted digital, ,4527554, ,"Uuittemberg [i.e., Wittenberg]",11389,Still Image, ,M.D.XXiij [1523],No Copyright - United States,03-B1132, , ,[Nickel Schirlentz],https://exhibitions.library.columbia.edu/exhibits/show/martin-luther/flug/flug2, , , , ,"Bible. John, XIV, 23-29|Holy Spirit|Pentecost season|Wittenberg (Germany)--Imprints (Nickel Schirlentz)", , , , , , , , , , , ,,,,,,
