omeka_393,perkins_zkc_002,original filename: 090074111.jpg,https://exhibitions.cul.columbia.edu/exhibits/show/perkins/early-years---family/columbia,,,Outline of Lectures on the Fiscal and Industrial History of the United States by Professor Edwin R. A. Seligman,,,,1909,pamphlets,aat,http://vocab.getty.edu/aat/300220572,,,,1909,,inferred,reformatted digital,"Rare Book & Manuscript Library, Columbia University",NNC-RB,marcorg,http://id.loc.gov/authorities/names/n78009986,eng,Box 121,Frances Perkins Papers,New York (N.Y.),http://id.loc.gov/authorities/names/n79007751,,eng,iso639-2,http://id.loc.gov/vocabulary/iso639-2/eng,,,,"Seligman, Edwin R. A. (Edwin Robert Anderson), 1861-1939",naf,http://id.loc.gov/authorities/names/n50005896,personal,"Perkins, Frances, 1880-1965",naf,http://id.loc.gov/authorities/names/n50012858,personal,,,,,,,,,,,,,,,,,,,,,,,,,,,,,New York (N.Y.),naf,http://id.loc.gov/authorities/names/n79007751,"Seligman, Edwin R. A. (Edwin Robert Anderson), 1861-1939",naf,http://id.loc.gov/authorities/names/n50005896,cre,marcrelator,code,http://id.loc.gov/vocabulary/relators/cre,personal,"Perkins, Frances, 1880-1965",,,ctb,marcrelator,code,http://id.loc.gov/vocabulary/relators/ctb,personal,,,,,,,,,,,,,,,,,,,,,,,,,,,,,,,,,,,,,,,,,,,,,,,,,,,,,,,,,,,,,,,,,,,,,,,,,,,,,,,,,,,,,,,,,,,,,,,,,"Seligman Economics 107 : Fiscal History printed syllabus, with manuscript notes by Frances Perkins",,,,,,"Gift of Susanna Perkins Coggeshall, 1973",still image,Frances Perkins: The Woman Behind the New Deal,http://www.columbia.edu/cgi-bin/cul/resolve?lweb0136
omeka_393,perkins_zkc_003,original filename: 090074112.jpg,https://exhibitions.cul.columbia.edu/exhibits/show/perkins/early-years---family/columbia,,,Outline of Lectures on the Fiscal and Industrial History of the United States by Professor Edwin R. A. Seligman,,,,1909,pamphlets,aat,http://vocab.getty.edu/aat/300220572,,,,1909,,inferred,reformatted digital,"Rare Book & Manuscript Library, Columbia University",NNC-RB,marcorg,http://id.loc.gov/authorities/names/n78009986,eng,Box 121,Frances Perkins Papers,New York (N.Y.),http://id.loc.gov/authorities/names/n79007751,,eng,iso639-2,http://id.loc.gov/vocabulary/iso639-2/eng,,,,"Seligman, Edwin R. A. (Edwin Robert Anderson), 1861-1939",naf,http://id.loc.gov/authorities/names/n50005896,personal,"Perkins, Frances, 1880-1965",naf,http://id.loc.gov/authorities/names/n50012858,personal,,,,,,,,,,,,,,,,,,,,,,,,,,,,,New York (N.Y.),naf,http://id.loc.gov/authorities/names/n79007751,"Seligman, Edwin R. A. (Edwin Robert Anderson), 1861-1939",naf,http://id.loc.gov/authorities/names/n50005896,cre,marcrelator,code,http://id.loc.gov/vocabulary/relators/cre,personal,"Perkins, Frances, 1880-1965",,,ctb,marcrelator,code,http://id.loc.gov/vocabulary/relators/ctb,personal,,,,,,,,,,,,,,,,,,,,,,,,,,,,,,,,,,,,,,,,,,,,,,,,,,,,,,,,,,,,,,,,,,,,,,,,,,,,,,,,,,,,,,,,,,,,,,,,,"Seligman Economics 107 : Fiscal History printed syllabus, with manuscript notes by Frances Perkins",,,,,,"Gift of Susanna Perkins Coggeshall, 1973",still image,Frances Perkins: The Woman Behind the New Deal,http://www.columbia.edu/cgi-bin/cul/resolve?lweb0136
omeka_393,perkins_zkc_004,original filename: 090074113.jpg,https://exhibitions.cul.columbia.edu/exhibits/show/perkins/early-years---family/columbia,,,Outline of Lectures on the Fiscal and Industrial History of the United States by Professor Edwin R. A. Seligman,,,,1909,pamphlets,aat,http://vocab.getty.edu/aat/300220572,,,,1909,,inferred,reformatted digital,"Rare Book & Manuscript Library, Columbia University",NNC-RB,marcorg,http://id.loc.gov/authorities/names/n78009986,eng,Box 121,Frances Perkins Papers,New York (N.Y.),http://id.loc.gov/authorities/names/n79007751,,eng,iso639-2,http://id.loc.gov/vocabulary/iso639-2/eng,,,,"Seligman, Edwin R. A. (Edwin Robert Anderson), 1861-1939",naf,http://id.loc.gov/authorities/names/n50005896,personal,"Perkins, Frances, 1880-1965",naf,http://id.loc.gov/authorities/names/n50012858,personal,,,,,,,,,,,,,,,,,,,,,,,,,,,,,New York (N.Y.),naf,http://id.loc.gov/authorities/names/n79007751,"Seligman, Edwin R. A. (Edwin Robert Anderson), 1861-1939",naf,http://id.loc.gov/authorities/names/n50005896,cre,marcrelator,code,http://id.loc.gov/vocabulary/relators/cre,personal,"Perkins, Frances, 1880-1965",,,ctb,marcrelator,code,http://id.loc.gov/vocabulary/relators/ctb,personal,,,,,,,,,,,,,,,,,,,,,,,,,,,,,,,,,,,,,,,,,,,,,,,,,,,,,,,,,,,,,,,,,,,,,,,,,,,,,,,,,,,,,,,,,,,,,,,,,"Seligman Economics 107 : Fiscal History printed syllabus, with manuscript notes by Frances Perkins",,,,,,"Gift of Susanna Perkins Coggeshall, 1973",still image,Frances Perkins: The Woman Behind the New Deal,http://www.columbia.edu/cgi-bin/cul/resolve?lweb0136
omeka_392,perkins_aok_001,original filename: perkins_090074107.jpg,https://exhibitions.cul.columbia.edu/exhibits/show/perkins/early-years---family/columbia,,,Fiscal History,,,,October 1909,manuscripts,lcsh,http://id.loc.gov/authorities/subjects/sh85080672,,,,1909-10,,,reformatted digital,"Rare Book & Manuscript Library, Columbia University",NNC-RB,marcorg,http://id.loc.gov/authorities/names/n78009986,eng,Box 121,Frances Perkins Papers,,,,eng,iso639-2,http://id.loc.gov/vocabulary/iso639-2/eng,,,,"Perkins, Frances, 1880-1965",naf,http://id.loc.gov/authorities/names/n50012858,personal,"Seligman, Edwin R. A. (Edwin Robert Anderson), 1861-1939",naf,http://id.loc.gov/authorities/names/n50005896,personal,,,,,,,,,,,,,,,,,,,,,,,,,,,,,New York (N.Y.),naf,http://id.loc.gov/authorities/names/n79007751,"Perkins, Frances, 1880-1965",naf,http://id.loc.gov/authorities/names/n50012858,cre,marcrelator,code,http://id.loc.gov/vocabulary/relators/cre,personal,,,,,,,,,,,,,,,,,,,,,,,,,,,,,,,,,,,,,,,,,,,,,,,,,,,,,,,,,,,,,,,,,,,,,,,,,,,,,,,,,,,,,,,,,,,,,,,,,,,,,,,,,"Frances Perkins' class notes for Economics 107 : Fiscal History, taught by Edwin Seligman at Columbia University",,,,,,"Gift of Susanna Perkins Coggeshall, 1973",still image,Frances Perkins: The Woman Behind the New Deal,http://www.columbia.edu/cgi-bin/cul/resolve?lweb0136
omeka_392,perkins_aok_002,original filename: 090074108.jpg,https://exhibitions.cul.columbia.edu/exhibits/show/perkins/early-years---family/columbia,,,Fiscal History,,,,October 1909,manuscripts,lcsh,http://id.loc.gov/authorities/subjects/sh85080672,,,,1909-10,,,reformatted digital,"Rare Book & Manuscript Library, Columbia University",NNC-RB,marcorg,http://id.loc.gov/authorities/names/n78009986,eng,Box 121,Frances Perkins Papers,,,,eng,iso639-2,http://id.loc.gov/vocabulary/iso639-2/eng,,,,"Perkins, Frances, 1880-1965",naf,http://id.loc.gov/authorities/names/n50012858,personal,"Seligman, Edwin R. A. (Edwin Robert Anderson), 1861-1939",naf,http://id.loc.gov/authorities/names/n50005896,personal,,,,,,,,,,,,,,,,,,,,,,,,,,,,,New York (N.Y.),naf,http://id.loc.gov/authorities/names/n79007751,"Perkins, Frances, 1880-1965",naf,http://id.loc.gov/authorities/names/n50012858,cre,marcrelator,code,http://id.loc.gov/vocabulary/relators/cre,personal,,,,,,,,,,,,,,,,,,,,,,,,,,,,,,,,,,,,,,,,,,,,,,,,,,,,,,,,,,,,,,,,,,,,,,,,,,,,,,,,,,,,,,,,,,,,,,,,,,,,,,,,,"Frances Perkins' class notes for Economics 107 : Fiscal History, taught by Edwin Seligman at Columbia University",,,,,,"Gift of Susanna Perkins Coggeshall, 1973",still image,Frances Perkins: The Woman Behind the New Deal,http://www.columbia.edu/cgi-bin/cul/resolve?lweb0136
omeka_392,perkins_aok_003,original filename: 090074109.jpg,https://exhibitions.cul.columbia.edu/exhibits/show/perkins/early-years---family/columbia,,,Fiscal History,,,,October 1909,manuscripts,lcsh,http://id.loc.gov/authorities/subjects/sh85080672,,,,1909-10,,,reformatted digital,"Rare Book & Manuscript Library, Columbia University",NNC-RB,marcorg,http://id.loc.gov/authorities/names/n78009986,eng,Box 121,Frances Perkins Papers,,,,eng,iso639-2,http://id.loc.gov/vocabulary/iso639-2/eng,,,,"Perkins, Frances, 1880-1965",naf,http://id.loc.gov/authorities/names/n50012858,personal,"Seligman, Edwin R. A. (Edwin Robert Anderson), 1861-1939",naf,http://id.loc.gov/authorities/names/n50005896,personal,,,,,,,,,,,,,,,,,,,,,,,,,,,,,New York (N.Y.),naf,http://id.loc.gov/authorities/names/n79007751,"Perkins, Frances, 1880-1965",naf,http://id.loc.gov/authorities/names/n50012858,cre,marcrelator,code,http://id.loc.gov/vocabulary/relators/cre,personal,,,,,,,,,,,,,,,,,,,,,,,,,,,,,,,,,,,,,,,,,,,,,,,,,,,,,,,,,,,,,,,,,,,,,,,,,,,,,,,,,,,,,,,,,,,,,,,,,,,,,,,,,"Frances Perkins' class notes for Economics 107 : Fiscal History, taught by Edwin Seligman at Columbia University",,,,,,"Gift of Susanna Perkins Coggeshall, 1973",still image,Frances Perkins: The Woman Behind the New Deal,http://www.columbia.edu/cgi-bin/cul/resolve?lweb0136
omeka_391,perkins_zjp_000,original filename: perkins_090074100.jpg,https://exhibitions.cul.columbia.edu/exhibits/show/perkins/triangle-fire/trangle-fire,,,"View of Asch Building, Washington Square during the Triangle Shirtwaist Factory fire",,,,March 1911,photographs,aat,http://vocab.getty.edu/aat/300046300,printed ephemera,aat,http://vocab.getty.edu/aat/300264821,1911-03,,inferred,reformatted digital,"Rare Book & Manuscript Library, Columbia University",NNC-RB,marcorg,http://id.loc.gov/authorities/names/n78009986,eng,Box 132?,Frances Perkins Papers,,,,eng,iso639-2,http://id.loc.gov/vocabulary/iso639-2/eng,,,,Triangle Shirtwaist Company Fire (1911),fast,http://id.worldcat.org/fast/1355168,,,,,,,,,,,,,,,,,,,,,,,,,,,,,,,,,,New York (N.Y.),naf,http://id.loc.gov/authorities/names/n79007751,,,,,,,,,,,,,,,,,,,,,,,,,,,,,,,,,,,,,,,,,,,,,,,,,,,,,,,,,,,,,,,,,,,,,,,,,,,,,,,,,,,,,,,,,,,,,,,,,,,,,,,,,,,,,,,,,"Includes photographs of the building after the fire, persons deceased in the fire, and lines of people waiting to identify the deceased at the New York City morgue",,,,,,,still image,Frances Perkins: The Woman Behind the New Deal,http://www.columbia.edu/cgi-bin/cul/resolve?lweb0136
omeka_391,perkins_zjp_001,original filename: 090074101.jpg,https://exhibitions.cul.columbia.edu/exhibits/show/perkins/triangle-fire/trangle-fire,,,Bodies of Triangle Shirtwaist Factory fire victims at the makeshift morgue on Charities Pier,,,,March 1911,photographs,aat,http://vocab.getty.edu/aat/300046300,printed ephemera,aat,http://vocab.getty.edu/aat/300264821,1911-03,,inferred,reformatted digital,"Rare Book & Manuscript Library, Columbia University",NNC-RB,marcorg,http://id.loc.gov/authorities/names/n78009986,eng,Box 132?,Frances Perkins Papers,,,,eng,iso639-2,http://id.loc.gov/vocabulary/iso639-2/eng,,,,Triangle Shirtwaist Company Fire (1911),fast,http://id.worldcat.org/fast/1355168,,,,,,,,,,,,,,,,,,,,,,,,,,,,,,,,,,New York (N.Y.),naf,http://id.loc.gov/authorities/names/n79007751,,,,,,,,,,,,,,,,,,,,,,,,,,,,,,,,,,,,,,,,,,,,,,,,,,,,,,,,,,,,,,,,,,,,,,,,,,,,,,,,,,,,,,,,,,,,,,,,,,,,,,,,,,,,,,,,,"Includes photographs of the building after the fire, persons deceased in the fire, and lines of people waiting to identify the deceased at the New York City morgue",,,,,,,still image,Frances Perkins: The Woman Behind the New Deal,http://www.columbia.edu/cgi-bin/cul/resolve?lweb0136
omeka_391,perkins_zjp_002,original filename: 090074102.jpg,https://exhibitions.cul.columbia.edu/exhibits/show/perkins/triangle-fire/trangle-fire,,,Bodies of Triangle Shirtwaist Factory fire victims on the sidewalk,,,,March 1911,photographs,aat,http://vocab.getty.edu/aat/300046300,printed ephemera,aat,http://vocab.getty.edu/aat/300264821,1911-03,,inferred,reformatted digital,"Rare Book & Manuscript Library, Columbia University",NNC-RB,marcorg,http://id.loc.gov/authorities/names/n78009986,eng,Box 132?,Frances Perkins Papers,,,,eng,iso639-2,http://id.loc.gov/vocabulary/iso639-2/eng,,,,Triangle Shirtwaist Company Fire (1911),fast,http://id.worldcat.org/fast/1355168,,,,,,,,,,,,,,,,,,,,,,,,,,,,,,,,,,New York (N.Y.),naf,http://id.loc.gov/authorities/names/n79007751,,,,,,,,,,,,,,,,,,,,,,,,,,,,,,,,,,,,,,,,,,,,,,,,,,,,,,,,,,,,,,,,,,,,,,,,,,,,,,,,,,,,,,,,,,,,,,,,,,,,,,,,,,,,,,,,,"Includes photographs of the building after the fire, persons deceased in the fire, and lines of people waiting to identify the deceased at the New York City morgue",,,,,,,still image,Frances Perkins: The Woman Behind the New Deal,http://www.columbia.edu/cgi-bin/cul/resolve?lweb0136
omeka_391,perkins_zjp_003,original filename: 090074103.jpg,https://exhibitions.cul.columbia.edu/exhibits/show/perkins/triangle-fire/trangle-fire,,,Crowds waiting to enter morgue to identify bodies of Triangle Shirtwaist fire in 1911; This scene is the pier at foot of 26th Street,,,,March 1911,photographs,aat,http://vocab.getty.edu/aat/300046300,printed ephemera,aat,http://vocab.getty.edu/aat/300264821,1911-03,,inferred,reformatted digital,"Rare Book & Manuscript Library, Columbia University",NNC-RB,marcorg,http://id.loc.gov/authorities/names/n78009986,eng,Box 132?,Frances Perkins Papers,,,,eng,iso639-2,http://id.loc.gov/vocabulary/iso639-2/eng,,,,Triangle Shirtwaist Company Fire (1911),fast,http://id.worldcat.org/fast/1355168,,,,,,,,,,,,,,,,,,,,,,,,,,,,,,,,,,New York (N.Y.),naf,http://id.loc.gov/authorities/names/n79007751,,,,,,,,,,,,,,,,,,,,,,,,,,,,,,,,,,,,,,,,,,,,,,,,,,,,,,,,,,,,,,,,,,,,,,,,,,,,,,,,,,,,,,,,,,,,,,,,,,,,,,,,,,,,,,,,,"Includes photographs of the building after the fire, persons deceased in the fire, and lines of people waiting to identify the deceased at the New York City morgue",,,,,,,still image,Frances Perkins: The Woman Behind the New Deal,http://www.columbia.edu/cgi-bin/cul/resolve?lweb0136
omeka_391,perkins_zjp_004,original filename: 090074104.jpg,https://exhibitions.cul.columbia.edu/exhibits/show/perkins/triangle-fire/trangle-fire,,,Photograph caption: Crowds waiting to enter morgue to identify bodies of Triangle Shirtwaist fire in 1911; this scene is the pier at foot of 26th Street,,,,March 1911,photographs,aat,http://vocab.getty.edu/aat/300046300,printed ephemera,aat,http://vocab.getty.edu/aat/300264821,1911-03,,inferred,reformatted digital,"Rare Book & Manuscript Library, Columbia University",NNC-RB,marcorg,http://id.loc.gov/authorities/names/n78009986,eng,Box 132?,Frances Perkins Papers,,,,eng,iso639-2,http://id.loc.gov/vocabulary/iso639-2/eng,,,,Triangle Shirtwaist Company Fire (1911),fast,http://id.worldcat.org/fast/1355168,,,,,,,,,,,,,,,,,,,,,,,,,,,,,,,,,,New York (N.Y.),naf,http://id.loc.gov/authorities/names/n79007751,,,,,,,,,,,,,,,,,,,,,,,,,,,,,,,,,,,,,,,,,,,,,,,,,,,,,,,,,,,,,,,,,,,,,,,,,,,,,,,,,,,,,,,,,,,,,,,,,,,,,,,,,,,,,,,,,"Includes photographs of the building after the fire, persons deceased in the fire, and lines of people waiting to identify the deceased at the New York City morgue",,,,,,,still image,Frances Perkins: The Woman Behind the New Deal,http://www.columbia.edu/cgi-bin/cul/resolve?lweb0136
omeka_391,perkins_zjp_005,original filename: 090074105.jpg,https://exhibitions.cul.columbia.edu/exhibits/show/perkins/triangle-fire/trangle-fire,,,View of ruins after blaze swept fire in Triangle Shirtwaist Factory ,,,,March 1911,photographs,aat,http://vocab.getty.edu/aat/300046300,printed ephemera,aat,http://vocab.getty.edu/aat/300264821,1911-03,,inferred,reformatted digital,"Rare Book & Manuscript Library, Columbia University",NNC-RB,marcorg,http://id.loc.gov/authorities/names/n78009986,eng,Box 132?,Frances Perkins Papers,,,,eng,iso639-2,http://id.loc.gov/vocabulary/iso639-2/eng,,,,Triangle Shirtwaist Company Fire (1911),fast,http://id.worldcat.org/fast/1355168,,,,,,,,,,,,,,,,,,,,,,,,,,,,,,,,,,New York (N.Y.),naf,http://id.loc.gov/authorities/names/n79007751,,,,,,,,,,,,,,,,,,,,,,,,,,,,,,,,,,,,,,,,,,,,,,,,,,,,,,,,,,,,,,,,,,,,,,,,,,,,,,,,,,,,,,,,,,,,,,,,,,,,,,,,,,,,,,,,,"Includes photographs of the building after the fire, persons deceased in the fire, and lines of people waiting to identify the deceased at the New York City morgue",,,,,,,still image,Frances Perkins: The Woman Behind the New Deal,http://www.columbia.edu/cgi-bin/cul/resolve?lweb0136
omeka_391,perkins_zjp_006,original filename: 090074106.jpg,https://exhibitions.cul.columbia.edu/exhibits/show/perkins/triangle-fire/trangle-fire,,,Photograph caption: View of ruins after blaze swept fire in Triangle Shirtwaist factory ,,,,March 1911,photographs,aat,http://vocab.getty.edu/aat/300046300,printed ephemera,aat,http://vocab.getty.edu/aat/300264821,1911-03,,inferred,reformatted digital,"Rare Book & Manuscript Library, Columbia University",NNC-RB,marcorg,http://id.loc.gov/authorities/names/n78009986,eng,Box 132?,Frances Perkins Papers,,,,eng,iso639-2,http://id.loc.gov/vocabulary/iso639-2/eng,,,,Triangle Shirtwaist Company Fire (1911),fast,http://id.worldcat.org/fast/1355168,,,,,,,,,,,,,,,,,,,,,,,,,,,,,,,,,,New York (N.Y.),naf,http://id.loc.gov/authorities/names/n79007751,,,,,,,,,,,,,,,,,,,,,,,,,,,,,,,,,,,,,,,,,,,,,,,,,,,,,,,,,,,,,,,,,,,,,,,,,,,,,,,,,,,,,,,,,,,,,,,,,,,,,,,,,,,,,,,,,"Includes photographs of the building after the fire, persons deceased in the fire, and lines of people waiting to identify the deceased at the New York City morgue",,,,,,,still image,Frances Perkins: The Woman Behind the New Deal,http://www.columbia.edu/cgi-bin/cul/resolve?lweb0136
omeka_390,perkins_ati_001,original filename: perkins_090074092.jpg,https://exhibitions.cul.columbia.edu/exhibits/show/perkins/triangle-fire/new-york-s-worst-fire,,,Draft for address by Frances Perkins at Cornell on the fiftieth anniversary of the Triangle Shirtwaist Fire,,,,"March 24, 1961",manuscripts,lcsh,http://id.loc.gov/authorities/subjects/sh85080672,,,,1961-03-24,,,reformatted digital,"Rare Book & Manuscript Library, Columbia University",NNC-RB,marcorg,http://id.loc.gov/authorities/names/n78009986,eng,Box 132,Frances Perkins Papers,,,,eng,iso639-2,http://id.loc.gov/vocabulary/iso639-2/eng,,,,Triangle Shirtwaist Company Fire (1911),fast,http://id.worldcat.org/fast/1355168,,"Perkins, Frances, 1880-1965",naf,http://id.loc.gov/authorities/names/n50012858,personal,,,,,,,,,,,,,,,,,,,,,,,,,,,,,Ithaca (N.Y.),naf,http://id.loc.gov/authorities/names/n79065769,"Perkins, Frances, 1880-1965",naf,http://id.loc.gov/authorities/names/n50012858,cre,marcrelator,code,http://id.loc.gov/vocabulary/relators/cre,personal,,,,,,,,,,,,,,,,,,,,,,,,,,,,,,,,,,,,,,,,,,,,,,,,,,,,,,,,,,,,,,,,,,,,,,,,,,,,,,,,,,,,,,,,,,,,,,,,,,,,,,,,,Frances Perkins' notebook with a draft of a talk discussing the Triangle Shirtwaist Fire,,,,,,"Gift of Susanna Perkins Coggeshall, 1970",still image,Frances Perkins: The Woman Behind the New Deal,http://www.columbia.edu/cgi-bin/cul/resolve?lweb0136
omeka_390,perkins_ati_002,original filename: 090074093.jpg,https://exhibitions.cul.columbia.edu/exhibits/show/perkins/triangle-fire/new-york-s-worst-fire,,,Draft for address by Frances Perkins at Cornell on the fiftieth anniversary of the Triangle Shirtwaist Fire,,,,"March 24, 1961",manuscripts,lcsh,http://id.loc.gov/authorities/subjects/sh85080672,,,,1961-03-24,,,reformatted digital,"Rare Book & Manuscript Library, Columbia University",NNC-RB,marcorg,http://id.loc.gov/authorities/names/n78009986,eng,Box 132,Frances Perkins Papers,,,,eng,iso639-2,http://id.loc.gov/vocabulary/iso639-2/eng,,,,Triangle Shirtwaist Company Fire (1911),fast,http://id.worldcat.org/fast/1355168,,"Perkins, Frances, 1880-1965",naf,http://id.loc.gov/authorities/names/n50012858,personal,,,,,,,,,,,,,,,,,,,,,,,,,,,,,Ithaca (N.Y.),naf,http://id.loc.gov/authorities/names/n79065769,"Perkins, Frances, 1880-1965",naf,http://id.loc.gov/authorities/names/n50012858,cre,marcrelator,code,http://id.loc.gov/vocabulary/relators/cre,personal,,,,,,,,,,,,,,,,,,,,,,,,,,,,,,,,,,,,,,,,,,,,,,,,,,,,,,,,,,,,,,,,,,,,,,,,,,,,,,,,,,,,,,,,,,,,,,,,,,,,,,,,,Frances Perkins' notebook with a draft of a talk discussing the Triangle Shirtwaist Fire,,,,,,"Gift of Susanna Perkins Coggeshall, 1970",still image,Frances Perkins: The Woman Behind the New Deal,http://www.columbia.edu/cgi-bin/cul/resolve?lweb0136
omeka_390,perkins_ati_003,original filename: 090074094.jpg,https://exhibitions.cul.columbia.edu/exhibits/show/perkins/triangle-fire/new-york-s-worst-fire,,,Draft for address by Frances Perkins at Cornell on the fiftieth anniversary of the Triangle Shirtwaist Fire,,,,"March 24, 1961",manuscripts,lcsh,http://id.loc.gov/authorities/subjects/sh85080672,,,,1961-03-24,,,reformatted digital,"Rare Book & Manuscript Library, Columbia University",NNC-RB,marcorg,http://id.loc.gov/authorities/names/n78009986,eng,Box 132,Frances Perkins Papers,,,,eng,iso639-2,http://id.loc.gov/vocabulary/iso639-2/eng,,,,Triangle Shirtwaist Company Fire (1911),fast,http://id.worldcat.org/fast/1355168,,"Perkins, Frances, 1880-1965",naf,http://id.loc.gov/authorities/names/n50012858,personal,,,,,,,,,,,,,,,,,,,,,,,,,,,,,Ithaca (N.Y.),naf,http://id.loc.gov/authorities/names/n79065769,"Perkins, Frances, 1880-1965",naf,http://id.loc.gov/authorities/names/n50012858,cre,marcrelator,code,http://id.loc.gov/vocabulary/relators/cre,personal,,,,,,,,,,,,,,,,,,,,,,,,,,,,,,,,,,,,,,,,,,,,,,,,,,,,,,,,,,,,,,,,,,,,,,,,,,,,,,,,,,,,,,,,,,,,,,,,,,,,,,,,,Frances Perkins' notebook with a draft of a talk discussing the Triangle Shirtwaist Fire,,,,,,"Gift of Susanna Perkins Coggeshall, 1970",still image,Frances Perkins: The Woman Behind the New Deal,http://www.columbia.edu/cgi-bin/cul/resolve?lweb0136
omeka_390,perkins_ati_004,original filename: 090074095.jpg,https://exhibitions.cul.columbia.edu/exhibits/show/perkins/triangle-fire/new-york-s-worst-fire,,,Draft for address by Frances Perkins at Cornell on the fiftieth anniversary of the Triangle Shirtwaist Fire,,,,"March 24, 1961",manuscripts,lcsh,http://id.loc.gov/authorities/subjects/sh85080672,,,,1961-03-24,,,reformatted digital,"Rare Book & Manuscript Library, Columbia University",NNC-RB,marcorg,http://id.loc.gov/authorities/names/n78009986,eng,Box 132,Frances Perkins Papers,,,,eng,iso639-2,http://id.loc.gov/vocabulary/iso639-2/eng,,,,Triangle Shirtwaist Company Fire (1911),fast,http://id.worldcat.org/fast/1355168,,"Perkins, Frances, 1880-1965",naf,http://id.loc.gov/authorities/names/n50012858,personal,,,,,,,,,,,,,,,,,,,,,,,,,,,,,Ithaca (N.Y.),naf,http://id.loc.gov/authorities/names/n79065769,"Perkins, Frances, 1880-1965",naf,http://id.loc.gov/authorities/names/n50012858,cre,marcrelator,code,http://id.loc.gov/vocabulary/relators/cre,personal,,,,,,,,,,,,,,,,,,,,,,,,,,,,,,,,,,,,,,,,,,,,,,,,,,,,,,,,,,,,,,,,,,,,,,,,,,,,,,,,,,,,,,,,,,,,,,,,,,,,,,,,,Frances Perkins' notebook with a draft of a talk discussing the Triangle Shirtwaist Fire,,,,,,"Gift of Susanna Perkins Coggeshall, 1970",still image,Frances Perkins: The Woman Behind the New Deal,http://www.columbia.edu/cgi-bin/cul/resolve?lweb0136
omeka_390,perkins_ati_005,original filename: 090074096.jpg,https://exhibitions.cul.columbia.edu/exhibits/show/perkins/triangle-fire/new-york-s-worst-fire,,,Draft for address by Frances Perkins at Cornell on the fiftieth anniversary of the Triangle Shirtwaist Fire,,,,"March 24, 1961",manuscripts,lcsh,http://id.loc.gov/authorities/subjects/sh85080672,,,,1961-03-24,,,reformatted digital,"Rare Book & Manuscript Library, Columbia University",NNC-RB,marcorg,http://id.loc.gov/authorities/names/n78009986,eng,Box 132,Frances Perkins Papers,,,,eng,iso639-2,http://id.loc.gov/vocabulary/iso639-2/eng,,,,Triangle Shirtwaist Company Fire (1911),fast,http://id.worldcat.org/fast/1355168,,"Perkins, Frances, 1880-1965",naf,http://id.loc.gov/authorities/names/n50012858,personal,,,,,,,,,,,,,,,,,,,,,,,,,,,,,Ithaca (N.Y.),naf,http://id.loc.gov/authorities/names/n79065769,"Perkins, Frances, 1880-1965",naf,http://id.loc.gov/authorities/names/n50012858,cre,marcrelator,code,http://id.loc.gov/vocabulary/relators/cre,personal,,,,,,,,,,,,,,,,,,,,,,,,,,,,,,,,,,,,,,,,,,,,,,,,,,,,,,,,,,,,,,,,,,,,,,,,,,,,,,,,,,,,,,,,,,,,,,,,,,,,,,,,,Frances Perkins' notebook with a draft of a talk discussing the Triangle Shirtwaist Fire,,,,,,"Gift of Susanna Perkins Coggeshall, 1970",still image,Frances Perkins: The Woman Behind the New Deal,http://www.columbia.edu/cgi-bin/cul/resolve?lweb0136
omeka_390,perkins_ati_006,original filename: 090074097.jpg,https://exhibitions.cul.columbia.edu/exhibits/show/perkins/triangle-fire/new-york-s-worst-fire,,,Draft for address by Frances Perkins at Cornell on the fiftieth anniversary of the Triangle Shirtwaist Fire,,,,"March 24, 1961",manuscripts,lcsh,http://id.loc.gov/authorities/subjects/sh85080672,,,,1961-03-24,,,reformatted digital,"Rare Book & Manuscript Library, Columbia University",NNC-RB,marcorg,http://id.loc.gov/authorities/names/n78009986,eng,Box 132,Frances Perkins Papers,,,,eng,iso639-2,http://id.loc.gov/vocabulary/iso639-2/eng,,,,Triangle Shirtwaist Company Fire (1911),fast,http://id.worldcat.org/fast/1355168,,"Perkins, Frances, 1880-1965",naf,http://id.loc.gov/authorities/names/n50012858,personal,,,,,,,,,,,,,,,,,,,,,,,,,,,,,Ithaca (N.Y.),naf,http://id.loc.gov/authorities/names/n79065769,"Perkins, Frances, 1880-1965",naf,http://id.loc.gov/authorities/names/n50012858,cre,marcrelator,code,http://id.loc.gov/vocabulary/relators/cre,personal,,,,,,,,,,,,,,,,,,,,,,,,,,,,,,,,,,,,,,,,,,,,,,,,,,,,,,,,,,,,,,,,,,,,,,,,,,,,,,,,,,,,,,,,,,,,,,,,,,,,,,,,,Frances Perkins' notebook with a draft of a talk discussing the Triangle Shirtwaist Fire,,,,,,"Gift of Susanna Perkins Coggeshall, 1970",still image,Frances Perkins: The Woman Behind the New Deal,http://www.columbia.edu/cgi-bin/cul/resolve?lweb0136
